{
  "surface_kind": "opl_package_payload_allowlist.v1",
  "package_id": "opl-flow",
  "plugin_id": "opl-flow",
  "source_repo": "https://github.com/gaofeng21cn/opl-flow.git",
  "source_root": ".",
  "paths": [
    "plugin.json",
    ".codex-plugin/plugin.json",
    "opl-package.json",
    "THIRD_PARTY_NOTICES.md",
    "contracts/fleet-telemetry-protocol.json",
    "contracts/fleet-telemetry-protocol.schema.json",
    "contracts/workflow-policy.json",
    "contracts/workflow-policy.schema.json",
    "profile/manifest.json",
    "profile/modules/01-user-preferences.md",
    "skills/manage-codex-tasks/SKILL.md",
    "skills/manage-codex-tasks/agents/openai.yaml",
    "skills/manage-codex-tasks/references/coordinate.md",
    "skills/manage-codex-tasks/references/migrate-owner.md",
    "skills/manage-codex-tasks/references/recover.md",
    "skills/opl-flow/SKILL.md",
    "skills/opl-flow/agents/openai.yaml",
    "skills/opl-flow/references/app-integration.md",
    "skills/opl-flow/references/codex-baseline.md",
    "skills/opl-flow/references/fleet/guide.md",
    "skills/opl-flow/references/ledger-start.md",
    "skills/opl-flow/references/ledger-supervisor.md",
    "skills/opl-flow/references/package-lifecycle.md",
    "skills/opl-flow/references/package-release.md",
    "skills/opl-flow/references/setup-update.md",
    "skills/opl-flow/references/terminal-readback.md",
    "skills/opl-flow/scripts/package_release.py",
    "skills/software-development/SKILL.md",
    "skills/software-development/agents/openai.yaml",
    "skills/software-development/references/architecture/grill/ADR-FORMAT.md",
    "skills/software-development/references/architecture/grill/CONTEXT-FORMAT.md",
    "skills/software-development/references/architecture/grill/guide.md",
    "skills/software-development/references/architecture/guide.md",
    "skills/software-development/references/architecture/improve/DEEPENING.md",
    "skills/software-development/references/architecture/improve/INTERFACE-DESIGN.md",
    "skills/software-development/references/architecture/improve/LANGUAGE.md",
    "skills/software-development/references/architecture/improve/guide.md",
    "skills/software-development/references/architecture/lenses/aposd.md",
    "skills/software-development/references/architecture/lenses/clean-architecture.md",
    "skills/software-development/references/architecture/lenses/domain-driven-design.md",
    "skills/software-development/references/architecture/map.md",
    "skills/software-development/references/architecture/simplification-audit.md",
    "skills/software-development/references/browser-evidence/encode_gif.py",
    "skills/software-development/references/browser-evidence/guide.md",
    "skills/software-development/references/delivery/guide.md",
    "skills/software-development/references/delivery/legacy-change.md",
    "skills/software-development/references/delivery/pre-push.md",
    "skills/software-development/references/delivery/production-change.md",
    "skills/software-development/references/docs/decision-records.md",
    "skills/software-development/references/docs/governance.md",
    "skills/software-development/references/docs/prose.md",
    "skills/software-development/references/docs/repository-voice.md",
    "skills/software-development/references/docs/site.md",
    "skills/software-development/references/docs/structure.md",
    "skills/software-development/references/docs/translation.md",
    "skills/software-development/references/github/patrol/decision-contract.md",
    "skills/software-development/references/github/patrol/github_patrol.py",
    "skills/software-development/references/github/patrol/guide.md",
    "skills/software-development/references/github/stacked-prs/guide.md",
    "skills/software-development/references/prototype/LOGIC.md",
    "skills/software-development/references/prototype/UI.md",
    "skills/software-development/references/prototype/guide.md",
    "skills/software-development/references/review.md",
    "skills/software-development/references/systems/distributed-data.md",
    "skills/software-development/references/systems/production-reliability.md",
    "scripts/opl_workflow.py",
    "scripts/opl_fleet.py",
    "scripts/fleet_inventory.py",
    "scripts/worktree_absorption_audit.py",
    "scripts/worktree_fleet_audit.py",
    "scripts/worktree_lifecycle.py",
    "templates/AGENTS.md",
    "templates/TASTE.md",
    "skills/software-development/references/grok-build/guide.md",
    "skills/software-development/references/grok-build/handoff-contract.md",
    "skills/software-development/scripts/run-grok-build-agent.sh"
  ]
}
